{
  "baseFeeCSC": "0.0000001",
  "ledgerVersion": 14804627,
  "ledgerHash": "9141FA171F2C0CE63E609466AF728FF66C12F7ACD4B4B50B0947A7F3409D593A",
  "ledgerTimestamp": "2015-07-23T05:50:40.000Z",
  "reserveBaseCSC": "0.2",
  "reserveIncrementCSC": "0.05",
  "transactionCount": 19,
  "validatedLedgerVersions": "13983423-14804627"
}
